{
  "event_study_spec_id": "EVS-2026-0001",
  "event_study_version": 1,
  "event_family": "earnings",
  "event_source_refs": ["DM-2026-0001"],
  "event_anchor_policy": "event_timestamp",
  "event_timestamp_policy": "date_only_allowed",
  "decision_timestamp_policy": "before_event_publication",
  "pre_event_window": {
    "start_offset": -5,
    "end_offset": -1,
    "units": "trading_days",
    "include_event_anchor": false,
    "window_role": "pre_event"
  },
  "post_event_window": {
    "start_offset": 0,
    "end_offset": 20,
    "units": "trading_days",
    "include_event_anchor": true,
    "window_role": "post_event"
  },
  "leakage_policy": "strict_no_lookahead",
  "event_deduplication_policy": "keep_first",
  "event_collision_policy": "reject_overlapping_windows",
  "missing_event_time_policy": "reject_event",
  "calendar_policy": "trading_days",
  "created_at": "2026-05-02T00:00:00Z",
  "reviewer": {
    "name": "dr_elliot_review_2026"
  }
}
